<?xml version="1.0" encoding="UTF-8"?>
<!DOCTYPE DOCUMENT SYSTEM "mydtd.dtd">
<DOCUMENT>
    <CUSTOMER TYPE = "Good">
        <NAME>
            <LAST_NAME> aaa </LAST_NAME>
            <FIRST_NAME> bbb </FIRST_NAME>
        </NAME>
        <DATE> 1/1/03 </DATE>
        <ORDERS class="SanPham">
            <ITEM>
                <PRODUCT>
                    <PRODUCT_ID>12</PRODUCT_ID>
                </PRODUCT>
                <NUMBER>25</NUMBER>
                <PRICE>20</PRICE>
            </ITEM>
            <ITEM>
                <PRODUCT>Tomatoes</PRODUCT>
                <NUMBER>25</NUMBER>
                <PRICE>3</PRICE>
            </ITEM>
        </ORDERS>
    </CUSTOMER>
</DOCUMENT>